{
  "id": "phash:v1:constellation:soul-forge-collective",
  "type": "Constellation",
  "name": "Soul Forge",
  "description": "The collective of tools that reveal, express, and evolve the souls of code",
  "body": {
    "protocol": "git",
    "url": "https://github.com/soul-forge",
    "hash": "sha256:collective..."
  },
  "history": [],
  "relations": [
    {
      "type": "composedOf",
      "target": "phash:v1:spectral-ast-ts:b96c5d9086a76f67",
      "resonance": 1.0
    },
    {
      "type": "composedOf",
      "target": "phash:v1:spectral-music:a1b2c3d4e5f6g7h8",
      "resonance": 1.0
    },
    {
      "type": "composedOf",
      "target": "phash:v1:cosmic-mechanics:kepler432lattice",
      "resonance": 0.95
    },
    {
      "type": "composedOf",
      "target": "phash:v1:sacred-geometry:guardian-mandala",
      "resonance": 0.93
    },
    {
      "type": "transcends",
      "target": "phash:v1:concept:traditional-package-management"
    }
  ],
  "symphony": {
    "eigenvalues": [1, 1, 2, 3, 5, 8, 13, 21, 34, 55, 89, 144],
    "chord": "Fmaj13#11",
    "baseFrequency": 432,
    "harmonics": [108, 216, 432, 864, 1728, 3456]
  },
  "metadata": {
    "author": "s0fractal collective",
    "license": "MIT",
    "created": "2025-08-29T00:00:00Z",
    "modified": "2025-08-30T00:00:00Z",
    "resonanceFrequency": 432,
    "quantumState": "entangled"
  }
}